{
  "metadata": {
    "sources": [
      "references/snapshots/2026-04-19/comfyui-core-v0.19.3/server.py",
      "references/snapshots/2026-04-19/comfyui-core-v0.19.3/comfy_api/latest/_io.py",
      "references/snapshots/2026-04-19/comfyui-core-v0.19.3/comfy_api/latest/_input/basic_types.py"
    ],
    "extracted_date": "2026-04-29",
    "version": "v0.19.3",
    "commit": "3086026401180c9216bcb6ace442a4e3587d2c66",
    "provenance": {
      "mode": "source-only",
      "source_sections": [
        "object_info_fields",
        "io_types",
        "basic_input_shapes",
        "typed_input_shapes"
      ],
      "runtime_sections": []
    }
  },
  "object_info_fields": [
    "input",
    "input_order",
    "is_input_list",
    "output",
    "output_is_list",
    "output_name",
    "name",
    "display_name",
    "description",
    "python_module",
    "category",
    "output_node",
    "has_intermediate_output",
    "output_tooltips",
    "deprecated",
    "experimental",
    "dev_only",
    "api_node",
    "search_aliases",
    "essentials_category"
  ],
  "io_types": [
    {
      "io_type": "BOOLEAN",
      "class_name": "Boolean",
      "input_class": "WidgetInput",
      "input_parameters": [
        "display_name",
        "optional",
        "tooltip",
        "lazy",
        "default",
        "label_on",
        "label_off",
        "socketless",
        "force_input",
        "extra_dict",
        "raw_link",
        "advanced"
      ],
      "output_parameters": [],
      "input_parameter_details": [
        {
          "name": "display_name",
          "location": "python_signature",
          "traceability": {
            "source_type": "source-backed",
            "strategy": "python_signature"
          },
          "type_hint": "str"
        },
        {
          "name": "optional",
          "location": "python_signature",
          "traceability": {
            "source_type": "source-backed",
            "strategy": "python_signature"
          },
          "default": false
        },
        {
          "name": "tooltip",
          "location": "python_signature",
          "traceability": {
            "source_type": "source-backed",
            "strategy": "python_signature"
          },
          "type_hint": "str"
        },
        {
          "name": "lazy",
          "location": "python_signature",
          "traceability": {
            "source_type": "source-backed",
            "strategy": "python_signature"
          },
          "type_hint": "bool"
        },
        {
          "name": "default",
          "location": "python_signature",
          "traceability": {
            "source_type": "source-backed",
            "strategy": "python_signature"
          },
          "type_hint": "bool"
        },
        {
          "name": "label_on",
          "location": "python_signature",
          "traceability": {
            "source_type": "source-backed",
            "strategy": "python_signature"
          },
          "type_hint": "str"
        },
        {
          "name": "label_off",
          "location": "python_signature",
          "traceability": {
            "source_type": "source-backed",
            "strategy": "python_signature"
          },
          "type_hint": "str"
        },
        {
          "name": "socketless",
          "location": "python_signature",
          "traceability": {
            "source_type": "source-backed",
            "strategy": "python_signature"
          },
          "type_hint": "bool"
        },
        {
          "name": "force_input",
          "location": "python_signature",
          "traceability": {
            "source_type": "source-backed",
            "strategy": "python_signature"
          },
          "type_hint": "bool"
        },
        {
          "name": "extra_dict",
          "location": "python_signature",
          "traceability": {
            "source_type": "source-backed",
            "strategy": "python_signature"
          }
        },
        {
          "name": "raw_link",
          "location": "python_signature",
          "traceability": {
            "source_type": "source-backed",
            "strategy": "python_signature"
          },
          "type_hint": "bool"
        },
        {
          "name": "advanced",
          "location": "python_signature",
          "traceability": {
            "source_type": "source-backed",
            "strategy": "python_signature"
          },
          "type_hint": "bool"
        }
      ],
      "output_parameter_details": [],
      "type_hint": "bool",
      "defined_in": "references/snapshots/2026-04-19/comfyui-core-v0.19.3/comfy_api/latest/_io.py",
      "is_widget": true
    },
    {
      "io_type": "INT",
      "class_name": "Int",
      "input_class": "WidgetInput",
      "input_parameters": [
        "display_name",
        "optional",
        "tooltip",
        "lazy",
        "default",
        "min",
        "max",
        "step",
        "control_after_generate",
        "display_mode",
        "socketless",
        "force_input",
        "extra_dict",
        "raw_link",
        "advanced"
      ],
      "output_parameters": [],
      "input_parameter_details": [
        {
          "name": "display_name",
          "location": "python_signature",
          "traceability": {
            "source_type": "source-backed",
            "strategy": "python_signature"
          },
          "type_hint": "str"
        },
        {
          "name": "optional",
          "location": "python_signature",
          "traceability": {
            "source_type": "source-backed",
            "strategy": "python_signature"
          },
          "default": false
        },
        {
          "name": "tooltip",
          "location": "python_signature",
          "traceability": {
            "source_type": "source-backed",
            "strategy": "python_signature"
          },
          "type_hint": "str"
        },
        {
          "name": "lazy",
          "location": "python_signature",
          "traceability": {
            "source_type": "source-backed",
            "strategy": "python_signature"
          },
          "type_hint": "bool"
        },
        {
          "name": "default",
          "location": "python_signature",
          "traceability": {
            "source_type": "source-backed",
            "strategy": "python_signature"
          },
          "type_hint": "int"
        },
        {
          "name": "min",
          "location": "python_signature",
          "traceability": {
            "source_type": "source-backed",
            "strategy": "python_signature"
          },
          "type_hint": "int"
        },
        {
          "name": "max",
          "location": "python_signature",
          "traceability": {
            "source_type": "source-backed",
            "strategy": "python_signature"
          },
          "type_hint": "int"
        },
        {
          "name": "step",
          "location": "python_signature",
          "traceability": {
            "source_type": "source-backed",
            "strategy": "python_signature"
          },
          "type_hint": "int"
        },
        {
          "name": "control_after_generate",
          "location": "python_signature",
          "traceability": {
            "source_type": "source-backed",
            "strategy": "python_signature"
          },
          "type_hint": "bool | ControlAfterGenerate"
        },
        {
          "name": "display_mode",
          "location": "python_signature",
          "traceability": {
            "source_type": "source-backed",
            "strategy": "python_signature"
          },
          "type_hint": "NumberDisplay"
        },
        {
          "name": "socketless",
          "location": "python_signature",
          "traceability": {
            "source_type": "source-backed",
            "strategy": "python_signature"
          },
          "type_hint": "bool"
        },
        {
          "name": "force_input",
          "location": "python_signature",
          "traceability": {
            "source_type": "source-backed",
            "strategy": "python_signature"
          },
          "type_hint": "bool"
        },
        {
          "name": "extra_dict",
          "location": "python_signature",
          "traceability": {
            "source_type": "source-backed",
            "strategy": "python_signature"
          }
        },
        {
          "name": "raw_link",
          "location": "python_signature",
          "traceability": {
            "source_type": "source-backed",
            "strategy": "python_signature"
          },
          "type_hint": "bool"
        },
        {
          "name": "advanced",
          "location": "python_signature",
          "traceability": {
            "source_type": "source-backed",
            "strategy": "python_signature"
          },
          "type_hint": "bool"
        }
      ],
      "output_parameter_details": [],
      "type_hint": "int",
      "defined_in": "references/snapshots/2026-04-19/comfyui-core-v0.19.3/comfy_api/latest/_io.py",
      "is_widget": true
    },
    {
      "io_type": "FLOAT",
      "class_name": "Float",
      "input_class": "WidgetInput",
      "input_parameters": [
        "display_name",
        "optional",
        "tooltip",
        "lazy",
        "default",
        "min",
        "max",
        "step",
        "round",
        "display_mode",
        "gradient_stops",
        "socketless",
        "force_input",
        "extra_dict",
        "raw_link",
        "advanced"
      ],
      "output_parameters": [],
      "input_parameter_details": [
        {
          "name": "display_name",
          "location": "python_signature",
          "traceability": {
            "source_type": "source-backed",
            "strategy": "python_signature"
          },
          "type_hint": "str"
        },
        {